"115";"0";"0";"22";"6464888";"-77";"0";"-66";"-66";"-77";"-77";"-66";"-77";"-77";"-77";"-77";"-77";"-77";"-77";"-77";"-77";"-77";"-77";"-77";"-77";"-77";"-77";"-66";"-77";"-66";"-66";"-77";"-66";"-66";"-77";"-77";"-66";"-66";"-66";"-66";"-66";"-66";"-66";"-66";"-66";"-66";"-66";"-77";"-77";"-77";"-77";"-77";"-77";"-77";"-77";"-77";"-77";"-77";"-77";"-77";"-77";"-77";"-77";"-77";"-77";"-77";"-77";"-77";"-77";"-77";"-77";"-77";"-77";"-77";"-77";"-77";"-77";"-77";"-77";"-77";"-77";"-77";"-77";"-77";"-77";"-77";"-77";"-66";"-66";"-66";"-66";"-66";"-66";"-66";"-66";"-66";"-66";"-77";"-77";"-77";"-77";"-77";"-77";"-77";"-77";"-77";"-77";"-77";"-77";"-77";"-77";"-77";"-77";"-77";"-77";"-77";"-77";"-77";"-77";"-77";"-77";"-77";"-77";"-77";"-77";"-77";"-77";"-77";"-77";"-77";"-77";"-77";"-77";"-77";"-77";"-77";"-77";"Mozilla/5.0 (Windows NT 6.1; Win64; x64) AppleWebKit/537.36 (KHTML, like Gecko) Chrome/81.0.4044.138 Safari/537.36";"-99";"0";"0";"-99";"0";"0";"0";"0";"0";"0";"0";"-99";"-99";"-66";"-66";"0";"-66";"6464885,6464886,6464888";"0";"0";"0";"-77";"-77";"575dbcac960405785ffa28d234114aad";"1";"0";"1590416850";"2020-05-25 14:27:30";"2020-05-25 14:27:58";"0000-00-00 00:00:00";"0";"0";"0";"28";"0";"0";"0";"0";"0";"0";"0";"0";"0";"0";"0";"0";"0";"0";"0";"0";"0";"0";"0";"0";"-66"
"116";"0";"0";"31";"6464875";"-77";"1908";"1";"1";"2";"1";"5ec9281f38d8e24282c64a77";"5";"5";"3";"6";"5";"2";"3";"4";"3";"-77";"3";"5";"6";"3";"4";"25";"1";"student";"19";"1";"-99";"-99";"5";"2";"-99";"they have had a falling out before ";"they waited too long and ran out of time ";"the member of yellow has said something bad";"the member of team yellow was late";"this member of yellow team is having a bad day";"they were unhappy with there current job";"the main cause is that yellow tries a new outfit";"they have been working harder";"each team has been assigned a task  ";"there relationship has become more loving  ";"3";"3";"3";"3";"4";"3";"3";"3";"4";"3";"4";"2";"2";"2";"3";"4";"2";"2";"2";"1";"2";"3";"3";"3";"3";"2";"4";"3";"3";"3";"2";"3";"4";"1";"2";"4";"4";"2";"2";"4";"-66";"-66";"-66";"-66";"-66";"-66";"-66";"-66";"-66";"-66";"-77";"-77";"-77";"-77";"-77";"-77";"-77";"-77";"-77";"-77";"-77";"-77";"-77";"-77";"-77";"-77";"-77";"-77";"-77";"-77";"-77";"-77";"-77";"-77";"-77";"-77";"-77";"-77";"-77";"-77";"-77";"-77";"-77";"-77";"-77";"-77";"-77";"-77";"-77";"-77";"Mozilla/5.0 (Windows NT 10.0; Win64; x64) AppleWebKit/537.36 (KHTML, like Gecko) Chrome/81.0.4044.138 Safari/537.36";"-99";"0";"0";"-99";"0";"0";"0";"0";"0";"0";"0";"-99";"-99";"-66";"-66";"0";"-66";"6464885,6464886,6464888,6465730,6473402,6473403,6465857,6464883,6464882,6464880,6479077,6479078,6479079,6465888,6465924,6473522,6530938,6473523,6467242,6466848,6466848,6466848,6466848,6466848,6466848,6466848,6466848,6466848,6466848,6535930,6467023,6521623,6473507,6521677,6466281,6467078,6521689,6521690,6464875";"1";"1";"0";"-77";"-77";"fff319d336597d02bcae043458a049ff";"1";"0";"1590416851";"2020-05-25 14:27:31";"2020-05-25 14:59:19";"0000-00-00 00:00:00";"159";"147";"126";"57";"81";"107";"271";"298";"1865";"1769";"0";"0";"1886";"91";"1810";"329";"0";"1799";"1841";"1891";"1908";"0";"313";"1788";"5bb4cf6e104d7438143cbcfae77baa30"
"117";"0";"0";"31";"6464887";"-77";"4";"-66";"-66";"-77";"-77";"-66";"-77";"-77";"-77";"-77";"-77";"-77";"-77";"-77";"-77";"-77";"-77";"-77";"-77";"-77";"-77";"-66";"-77";"-66";"-66";"-77";"-66";"-66";"-77";"-77";"-66";"-66";"-66";"-66";"-66";"-66";"-66";"-66";"-66";"-66";"-66";"-77";"-77";"-77";"-77";"-77";"-77";"-77";"-77";"-77";"-77";"-77";"-77";"-77";"-77";"-77";"-77";"-77";"-77";"-77";"-77";"-77";"-77";"-77";"-77";"-77";"-77";"-77";"-77";"-77";"-77";"-77";"-77";"-77";"-77";"-77";"-77";"-77";"-77";"-77";"-77";"-66";"-66";"-66";"-66";"-66";"-66";"-66";"-66";"-66";"-66";"-77";"-77";"-77";"-77";"-77";"-77";"-77";"-77";"-77";"-77";"-77";"-77";"-77";"-77";"-77";"-77";"-77";"-77";"-77";"-77";"-77";"-77";"-77";"-77";"-77";"-77";"-77";"-77";"-77";"-77";"-77";"-77";"-77";"-77";"-77";"-77";"-77";"-77";"-77";"-77";"Mozilla/5.0 (Linux; Android 10; POT-LX1) AppleWebKit/537.36 (KHTML, like Gecko) Chrome/81.0.4044.138 Mobile Safari/537.36";"-99";"0";"0";"-99";"0";"0";"0";"0";"0";"0";"0";"-99";"-99";"-66";"-66";"0";"-66";"6464885,6464886,6464887";"1";"0";"0";"-77";"-77";"8f4a3950e582baaecc9c1c00d1b4922f";"1";"0";"1590416862";"2020-05-25 14:27:42";"2020-05-25 14:27:46";"0000-00-00 00:00:00";"0";"0";"0";"4";"0";"0";"0";"0";"0";"0";"0";"0";"0";"0";"0";"0";"0";"0";"0";"0";"0";"0";"0";"0";"-66"
"118";"0";"0";"20";"0";"-77";"0";"-66";"-66";"-77";"-77";"-66";"-77";"-77";"-77";"-77";"-77";"-77";"-77";"-77";"-77";"-77";"-77";"-77";"-77";"-77";"-77";"-66";"-77";"-66";"-66";"-77";"-66";"-66";"-77";"-77";"-66";"-66";"-66";"-66";"-66";"-66";"-66";"-66";"-66";"-66";"-66";"-77";"-77";"-77";"-77";"-77";"-77";"-77";"-77";"-77";"-77";"-77";"-77";"-77";"-77";"-77";"-77";"-77";"-77";"-77";"-77";"-77";"-77";"-77";"-77";"-77";"-77";"-77";"-77";"-77";"-77";"-77";"-77";"-77";"-77";"-77";"-77";"-77";"-77";"-77";"-77";"-66";"-66";"-66";"-66";"-66";"-66";"-66";"-66";"-66";"-66";"-77";"-77";"-77";"-77";"-77";"-77";"-77";"-77";"-77";"-77";"-77";"-77";"-77";"-77";"-77";"-77";"-77";"-77";"-77";"-77";"-77";"-77";"-77";"-77";"-77";"-77";"-77";"-77";"-77";"-77";"-77";"-77";"-77";"-77";"-77";"-77";"-77";"-77";"-77";"-77";"Mozilla/5.0 (Linux; Android 8.1.0; SAMSUNG SM-J530F) AppleWebKit/537.36 (KHTML, like Gecko) SamsungBrowser/11.2 Chrome/75.0.3770.143 Mobile Safari/537.36";"-99";"0";"0";"-99";"0";"0";"0";"0";"0";"0";"0";"-99";"-99";"-66";"-66";"0";"-66";"0";"0";"0";"0";"-77";"-77";"edaa12b4178a72e1b437d8e1fb979130";"1";"0";"1590416863";"2020-05-25 14:27:43";"2020-05-25 14:27:43";"0000-00-00 00:00:00";"0";"0";"0";"0";"0";"0";"0";"0";"0";"0";"0";"0";"0";"0";"0";"0";"0";"0";"0";"0";"0";"0";"0";"0";"-66"
"119";"0";"0";"31";"6464875";"-77";"1401";"1";"2";"2";"1";"5a62141f13898300014b1ea6";"7";"6";"3";"4";"5";"1";"3";"9";"-77";"2";"3";"7";"8";"6";"6";"33";"2";"illustrator";"24";"1";"-99";"none";"7";"2";"-99";"-66";"-66";"-66";"-66";"-66";"-66";"-66";"-66";"-66";"-66";"-77";"-77";"-77";"-77";"-77";"-77";"-77";"-77";"-77";"-77";"-77";"-77";"-77";"-77";"-77";"-77";"-77";"-77";"-77";"-77";"-77";"-77";"-77";"-77";"-77";"-77";"-77";"-77";"-77";"-77";"-77";"-77";"-77";"-77";"-77";"-77";"-77";"-77";"-77";"-77";"He had a bad day";"The task was too hard to complete";"The audience was not interested in the subject of the talk";"he had a bad day";"He was not simphatetic to the others";"He is a lucky fellow";"The friend is a nice person";"He is lucky";"He is well qualified";"He is a lucky guy";"1";"3";"5";"3";"4";"3";"1";"4";"1";"5";"1";"2";"5";"2";"4";"2";"1";"4";"1";"5";"5";"4";"5";"4";"2";"5";"1";"4";"3";"5";"3";"3";"1";"3";"2";"5";"1";"4";"2";"5";"Mozilla/5.0 (Windows NT 10.0; Win64; x64) AppleWebKit/537.36 (KHTML, like Gecko) Chrome/81.0.4044.138 Safari/537.36";"-99";"0";"0";"-99";"0";"0";"0";"0";"0";"0";"0";"-99";"-99";"-66";"-66";"0";"-66";"6464885,6464886,6464888,6465730,6473402,6473403,6465857,6464883,6464882,6464880,6479077,6479078,6479079,6465888,6465924,6473522,6467023,6529429,6467037,6470606,6467043,6467043,6467043,6467043,6467043,6467043,6467043,6467043,6467043,6467043,6521622,6521623,6473507,6521677,6466281,6467078,6521689,6521690,6464875";"0";"1";"0";"-77";"-77";"20d6c697500d4a6d5005eadb09aa34b9";"1";"0";"1590416878";"2020-05-25 14:27:58";"2020-05-25 14:51:19";"0000-00-00 00:00:00";"287";"230";"140";"39";"66";"98";"592";"646";"1362";"0";"757";"1198";"1367";"87";"1274";"0";"1239";"1254";"1335";"1376";"1401";"665";"0";"0";"8e79eb625a67da849249846a53d55e7e"
"120";"0";"0";"31";"6464875";"-77";"1866";"2";"2";"2";"1";"5eac266aaf3d5f23eedea4d5";"1";"1";"3";"1";"1";"1";"2";"7";"-77";"6";"2";"8";"7";"9";"9";"5";"1";"Sales";"28";"1";"-99";"No";"6";"2";"-99";"-66";"-66";"-66";"-66";"-66";"-66";"-66";"-66";"-66";"-66";"-77";"-77";"-77";"-77";"-77";"-77";"-77";"-77";"-77";"-77";"-77";"-77";"-77";"-77";"-77";"-77";"-77";"-77";"-77";"-77";"-77";"-77";"-77";"-77";"-77";"-77";"-77";"-77";"-77";"-77";"-77";"-77";"-77";"-77";"-77";"-77";"-77";"-77";"-77";"-77";"It was intentional ";"Temporary ";"It is variable over time";"It is outside of this member of group green";"Negative ";"Positive ";"Reflects an aspect of this member of group green";"It is progress ";"The main cause of action was intentional ";"Is emotional ";"1";"2";"4";"3";"1";"1";"1";"1";"5";"1";"3";"3";"4";"4";"1";"1";"2";"2";"1";"1";"1";"2";"3";"3";"3";"1";"3";"3";"3";"4";"5";"1";"3";"3";"1";"3";"3";"2";"4";"5";"Mozilla/5.0 (X11; Linux x86_64) AppleWebKit/537.36 (KHTML, like Gecko) Chrome/77.0.3865.92 Safari/537.36";"-99";"0";"0";"-99";"0";"0";"0";"0";"0";"0";"0";"-99";"-99";"-66";"-66";"0";"-66";"6464885,6464886,6464888,6465730,6473402,6473403,6465857,6464883,6464882,6464880,6479077,6479079,6479080,6465888,6465924,6473522,6467023,6529429,6467037,6470606,6467043,6467043,6467043,6467043,6467043,6467043,6467043,6467043,6467043,6467043,6521622,6521623,6473507,6521677,6466281,6467078,6521689,6521690,6464875";"0";"1";"0";"-77";"-77";"65e4e08af5f0e779e3363cca0fbda02b";"1";"0";"1590416890";"2020-05-25 14:28:10";"2020-05-25 14:59:16";"0000-00-00 00:00:00";"321";"256";"169";"74";"103";"132";"460";"525";"1760";"0";"599";"1554";"1804";"126";"1642";"0";"1588";"1616";"1715";"1824";"1866";"541";"0";"0";"839e7a24425da6172ef1c50129483b44"
"121";"0";"0";"31";"6464875";"-77";"980";"1";"2";"2";"1";"5dc3fe9b547c1f2dabd5a67b";"9";"9";"9";"9";"9";"2";"2";"2";"-77";"4";"6";"5";"5";"1";"1";"36";"2";"photographer";"21";"1";"-99";"-99";"7";"2";"-99";"-66";"-66";"-66";"-66";"-66";"-66";"-66";"-66";"-66";"-66";"-77";"-77";"-77";"-77";"-77";"-77";"-77";"-77";"-77";"-77";"-77";"-77";"-77";"-77";"-77";"-77";"-77";"-77";"-77";"-77";"-77";"-77";"-77";"-77";"-77";"-77";"-77";"-77";"-77";"-77";"-77";"-77";"-77";"-77";"-77";"-77";"-77";"-77";"-77";"-77";"friend maybe just had a bad day";"ran out of time";"Something that the audience does not agree with";"maybe both just having a bad day";"dont know how to help";"prepared well and fits the job role well";"Have good friends and the friend is a kind person";"has been working hard and thats been recognised";"prepared and worked hard on the project";"feel more comfortable with each other";"3";"3";"3";"3";"2";"1";"5";"1";"1";"3";"2";"3";"2";"3";"2";"1";"3";"2";"2";"2";"2";"1";"3";"3";"0";"1";"1";"2";"1";"2";"1";"4";"4";"4";"1";"1";"2";"1";"2";"3";"Mozilla/5.0 (Windows NT 10.0; WOW64; Trident/7.0; rv:11.0) like Gecko";"-99";"0";"0";"-99";"0";"0";"0";"0";"0";"0";"0";"-99";"-99";"-66";"-66";"0";"-66";"6464885,6464886,6464888,6465730,6473402,6473403,6465857,6464883,6464882,6464880,6479077,6479078,6479079,6465888,6465924,6473522,6467023,6529429,6467037,6470606,6467043,6467043,6467043,6467043,6467043,6467043,6467043,6467043,6467043,6467043,6521622,6521623,6473507,6521677,6466281,6467078,6521689,6521690,6464875";"0";"1";"0";"-77";"-77";"cc5380630d7313c1f02af9ef65aa9845";"1";"0";"1590416893";"2020-05-25 14:28:13";"2020-05-25 14:44:33";"0000-00-00 00:00:00";"101";"79";"36";"8";"18";"29";"317";"352";"957";"0";"376";"864";"964";"24";"910";"0";"885";"899";"940";"967";"980";"360";"0";"0";"d704b414a618982dcd94117d1d501783"
"122";"0";"0";"31";"6464875";"-77";"1228";"1";"2";"2";"1";"5d8b3d23f8a54b0019cc1cd9";"6";"7";"4";"7";"3";"1";"3";"6";"-77";"6";"2";"7";"6";"1";"2";"28";"2";"Operations";"27";"1";"-99";"-99";"5";"2";"-99";"-66";"-66";"-66";"-66";"-66";"-66";"-66";"-66";"-66";"-66";"-77";"-77";"-77";"-77";"-77";"-77";"-77";"-77";"-77";"-77";"-77";"-77";"-77";"-77";"-77";"-77";"-77";"-77";"-77";"-77";"-77";"-77";"-77";"-77";"-77";"-77";"-77";"-77";"-77";"-77";"-77";"-77";"-77";"-77";"-77";"-77";"-77";"-77";"-77";"-77";"Meeting someone outside of their team";"An assumption of the member of group Green and the Green team";"Potentially group green has been taught incorrectly";"Favourable to members only in the green group";"The do not like the member who has approached them and is not in their team";"They researched for their new role";"Someone new that they are meeting";"The member worked hard for the raise";"Intelligent in the subject of the project";"The favour their partners team";"1";"1";"1";"1";"1";"1";"5";"1";"1";"2";"5";"1";"1";"1";"1";"3";"4";"1";"3";"1";"3";"3";"2";"3";"4";"1";"1";"2";"2";"1";"4";"3";"2";"3";"5";"3";"2";"1";"2";"1";"Mozilla/5.0 (Windows NT 6.3; Win64; x64) AppleWebKit/537.36 (KHTML, like Gecko) Chrome/81.0.4044.138 Safari/537.36";"-99";"0";"0";"-99";"0";"0";"0";"0";"0";"0";"0";"-99";"-99";"-66";"-66";"0";"-66";"6464885,6464886,6464888,6465730,6473402,6473403,6465857,6464883,6464882,6464880,6479077,6479078,6479079,6465888,6465924,6473522,6467023,6529429,6467037,6470606,6467043,6467043,6467043,6467043,6467043,6467043,6467043,6467043,6467043,6467043,6521622,6521623,6521623,6473507,6521677,6466281,6467078,6521689,6521690,6464875";"0";"1";"0";"-77";"-77";"370f77c036c5916a1ff48052f8ed6810";"1";"0";"1590416895";"2020-05-25 14:28:15";"2020-05-25 14:48:43";"0000-00-00 00:00:00";"300";"254";"177";"38";"94";"122";"401";"437";"1122";"0";"498";"986";"1127";"118";"1079";"0";"1035";"1055";"1106";"1129";"1228";"448";"0";"0";"c592b323a77a28f906f72b62ba2039f1"
"123";"0";"0";"31";"6464875";"-77";"807";"2";"1";"2";"1";"5e93bca37925136fd7987178";"3";"2";"3";"1";"2";"1";"1";"5";"2";"-77";"2";"7";"6";"8";"8";"4";"1";"Student";"20";"1";"-99";"-99";"5";"2";"-99";"Because they are favouring others";"He was Tired";"They judge by the group colour";"Because they do not have back up from another group member";"Was busy";"Hard working and resilient";"Friend was nice";"Hardworking";"Hardworking";"Because they have common interests";"2";"4";"1";"5";"4";"2";"1";"1";"2";"3";"4";"4";"5";"5";"4";"2";"1";"1";"1";"2";"5";"1";"3";"4";"4";"2";"2";"1";"2";"3";"5";"2";"4";"3";"4";"3";"3";"2";"1";"3";"-66";"-66";"-66";"-66";"-66";"-66";"-66";"-66";"-66";"-66";"-77";"-77";"-77";"-77";"-77";"-77";"-77";"-77";"-77";"-77";"-77";"-77";"-77";"-77";"-77";"-77";"-77";"-77";"-77";"-77";"-77";"-77";"-77";"-77";"-77";"-77";"-77";"-77";"-77";"-77";"-77";"-77";"-77";"-77";"-77";"-77";"-77";"-77";"-77";"-77";"Mozilla/5.0 (Macintosh; Intel Mac OS X 10_15_0) AppleWebKit/537.36 (KHTML, like Gecko) Chrome/81.0.4044.138 Safari/537.36";"-99";"0";"0";"-99";"0";"0";"0";"0";"0";"0";"0";"-99";"-99";"-66";"-66";"0";"-66";"6464885,6464886,6464888,6465730,6473402,6473403,6465857,6464883,6464882,6464880,6479077,6479079,6479080,6465888,6465924,6473522,6530938,6473523,6467242,6466848,6466848,6466848,6466848,6466848,6466848,6466848,6466848,6466848,6466848,6535930,6467023,6521623,6473507,6521677,6466281,6467078,6521689,6521690,6464875";"1";"0";"0";"-77";"-77";"f857b51d4c94cdab19c8c451fe58f285";"1";"0";"1590416914";"2020-05-25 14:28:34";"2020-05-25 14:42:01";"0000-00-00 00:00:00";"69";"60";"33";"6";"15";"31";"179";"211";"786";"712";"0";"0";"788";"19";"745";"236";"0";"738";"774";"791";"807";"0";"223";"730";"f292997b7ece788dcd1e744c69b96e83"
"124";"0";"0";"31";"6464875";"-77";"1374";"2";"2";"2";"1";"5daa158e4d91b900168edeea";"3";"3";"4";"2";"3";"1";"2";"8";"-77";"5";"3";"2";"3";"8";"9";"10";"2";"Tutor";"29";"1";"-99";"-99";"6";"2";"-99";"-66";"-66";"-66";"-66";"-66";"-66";"-66";"-66";"-66";"-66";"-77";"-77";"-77";"-77";"-77";"-77";"-77";"-77";"-77";"-77";"-77";"-77";"-77";"-77";"-77";"-77";"-77";"-77";"-77";"-77";"-77";"-77";"-77";"-77";"-77";"-77";"-77";"-77";"-77";"-77";"-77";"-77";"-77";"-77";"-77";"-77";"-77";"-77";"-77";"-77";"This person must have either knowingly or not have caused some type of harm to the other";"Green has trouble keeping up with their priorities";"The member didn't do a background the check on the audience before creating their speech.";"An argument may have erupted between the two";"This friend may not be on good terms with the green member.";"The had the necessary skills and pull to get the job";"This person is more attractive than usual to the other person to make such a compliment";"This person performed so well at their job that they were awarded a raise";"The member knew what was required for the project and did it well.";"This person may have changed their ways positively and their partner has taken notice of this.";"2";"2";"2";"3";"4";"4";"2";"4";"4";"4";"2";"2";"2";"3";"4";"4";"2";"4";"4";"4";"3";"4";"3";"2";"5";"3";"2";"5";"5";"2";"2";"3";"3";"3";"4";"4";"3";"4";"3";"2";"Mozilla/5.0 (Windows NT 10.0; Win64; x64) AppleWebKit/537.36 (KHTML, like Gecko) Chrome/81.0.4044.138 Safari/537.36";"-99";"0";"0";"-99";"0";"0";"0";"0";"0";"0";"0";"-99";"-99";"-66";"-66";"0";"-66";"6464885,6464886,6464888,6465730,6473402,6473403,6465857,6464883,6464882,6464880,6479077,6479079,6479080,6465888,6465924,6473522,6467023,6529429,6467037,6470606,6467043,6467043,6467043,6467043,6467043,6467043,6467043,6467043,6467043,6467043,6521622,6521623,6473507,6521677,6466281,6467078,6521689,6521690,6464875";"0";"1";"0";"-77";"-77";"f6d6f8cce79917980d9977304db76322";"1";"0";"1590416931";"2020-05-25 14:28:51";"2020-05-25 14:51:45";"0000-00-00 00:00:00";"157";"138";"84";"19";"39";"67";"273";"305";"1304";"0";"350";"1168";"1336";"56";"1223";"0";"1199";"1213";"1281";"1341";"1374";"315";"0";"0";"f73959ac113d90891e2761fd265eb371"
"125";"0";"0";"31";"6464875";"-77";"646";"1";"1";"2";"1";"59e0be41d838ae0001850712";"6";"6";"4";"4";"4";"1";"3";"6";"2";"-77";"4";"8";"8";"2";"3";"40";"2";"Admin assistant";"32";"1";"-99";"-99";"7";"2";"-99";"The friend may be stressed";"They have too much work to do and not enough time.";"They didn't prepare enough for the particular audience";"The other person may not like them";"They have their own problems";"That they are the right person for the job ";"Their friend is a nice person";"They are competent at their job";"They put a lot of work into the project";"They are happy so causing the other person to be happy too";"5";"4";"2";"4";"1";"1";"5";"1";"1";"2";"4";"4";"3";"4";"1";"1";"5";"2";"2";"3";"4";"4";"4";"4";"4";"2";"3";"2";"3";"3";"3";"4";"4";"4";"3";"2";"3";"3";"3";"3";"-66";"-66";"-66";"-66";"-66";"-66";"-66";"-66";"-66";"-66";"-77";"-77";"-77";"-77";"-77";"-77";"-77";"-77";"-77";"-77";"-77";"-77";"-77";"-77";"-77";"-77";"-77";"-77";"-77";"-77";"-77";"-77";"-77";"-77";"-77";"-77";"-77";"-77";"-77";"-77";"-77";"-77";"-77";"-77";"-77";"-77";"-77";"-77";"-77";"-77";"Mozilla/5.0 (Macintosh; Intel Mac OS X 10_15_2) AppleWebKit/537.36 (KHTML, like Gecko) Chrome/80.0.3987.149 Safari/537.36";"-99";"0";"0";"-99";"0";"0";"0";"0";"0";"0";"0";"-99";"-99";"-66";"-66";"0";"-66";"6464885,6464886,6464888,6465730,6473402,6473403,6465857,6464883,6464882,6464880,6479077,6479078,6479079,6465888,6479079,6465888,6465924,6473522,6530938,6473523,6467242,6466848,6466848,6466848,6466848,6466848,6466848,6466848,6466848,6466848,6466848,6535930,6467023,6521623,6473507,6521677,6466281,6467078,6521689,6521690,6464875";"1";"1";"0";"-77";"-77";"175b616e5e1e8bccdc1ba850a58b8c85";"1";"0";"1590416941";"2020-05-25 14:29:01";"2020-05-25 14:39:47";"0000-00-00 00:00:00";"129";"111";"61";"17";"31";"42";"233";"259";"610";"548";"0";"0";"632";"37";"576";"291";"0";"570";"595";"634";"646";"0";"265";"562";"adcbfbd9c9c8b6c0d5803e79a3e7dae1"
"126";"0";"0";"31";"6464875";"-77";"686";"2";"2";"2";"1";"5df9142591be8f03c0eff821";"5";"9";"5";"2";"6";"1";"2";"6";"-77";"6";"2";"5";"5";"9";"9";"4";"1";"Chef";"29";"1";"-99";"No";"7";"2";"-99";"-66";"-66";"-66";"-66";"-66";"-66";"-66";"-66";"-66";"-66";"-77";"-77";"-77";"-77";"-77";"-77";"-77";"-77";"-77";"-77";"-77";"-77";"-77";"-77";"-77";"-77";"-77";"-77";"-77";"-77";"-77";"-77";"-77";"-77";"-77";"-77";"-77";"-77";"-77";"-77";"-77";"-77";"-77";"-77";"-77";"-77";"-77";"-77";"-77";"-77";"Selfish";"Don't have time to complete the work";"They said something that was unpopular ";"They did not share the same interests ";"They don't care about other people's problems.";"They had the right skills for the job.";"They have been looking after themselves.";"Because they are good at their job";"Did well on the project";"They are a good partner so in turn get treated nicely.";"2";"2";"2";"3";"1";"1";"5";"4";"5";"5";"3";"3";"3";"3";"1";"1";"5";"4";"4";"5";"3";"5";"2";"3";"1";"1";"5";"2";"2";"5";"4";"5";"4";"3";"1";"1";"5";"2";"2";"5";"Mozilla/5.0 (Windows NT 10.0; Win64; x64) AppleWebKit/537.36 (KHTML, like Gecko) Chrome/81.0.4044.138 Safari/537.36";"-99";"0";"0";"-99";"0";"0";"0";"0";"0";"0";"0";"-99";"-99";"-66";"-66";"0";"-66";"6464885,6464886,6464888,6465730,6473402,6473403,6465857,6464883,6464882,6464880,6479077,6479079,6479080,6465888,6465924,6473522,6467023,6529429,6467037,6470606,6467043,6467043,6467043,6467043,6467043,6467043,6467043,6467043,6467043,6467043,6521622,6521623,6473507,6521677,6466281,6467078,6521689,6521690,6464875";"1";"1";"0";"-77";"-77";"48f542cb5daf8a6a039ef4df9be1efd3";"1";"0";"1590416943";"2020-05-25 14:29:03";"2020-05-25 14:40:29";"0000-00-00 00:00:00";"119";"97";"60";"21";"32";"43";"238";"261";"651";"0";"299";"575";"662";"38";"613";"0";"593";"605";"637";"666";"686";"270";"0";"0";"a813473054e23391f63e8196afcee964"
"127";"0";"0";"31";"6464875";"-77";"927";"1";"1";"2";"1";"5c79211f477abb00168f7f72";"7";"7";"5";"6";"7";"1";"3";"7";"2";"-77";"4";"8";"8";"5";"4";"28";"2";"Homemaker";"53";"1";"-99";"Thank you";"7";"2";"-99";"I do not know the reason for the hostility.";"I would question why this is the situation.";"Unwelcome news that was communicated.";"They met a member of the green/blue group.";"I would question why they were unwilling to help.";"Determination to obtain the job.";"Paying a compliment to the other person.";"Why did they get this? Did they deserve it?";"They worked very hard on this project so probably deserved the praise.";"Depends on the relationship.";"3";"3";"4";"3";"4";"2";"4";"3";"2";"4";"4";"3";"3";"3";"3";"2";"2";"3";"2";"4";"3";"3";"3";"3";"3";"2";"2";"3";"3";"3";"3";"3";"3";"3";"3";"2";"3";"3";"3";"3";"-66";"-66";"-66";"-66";"-66";"-66";"-66";"-66";"-66";"-66";"-77";"-77";"-77";"-77";"-77";"-77";"-77";"-77";"-77";"-77";"-77";"-77";"-77";"-77";"-77";"-77";"-77";"-77";"-77";"-77";"-77";"-77";"-77";"-77";"-77";"-77";"-77";"-77";"-77";"-77";"-77";"-77";"-77";"-77";"-77";"-77";"-77";"-77";"-77";"-77";"Mozilla/5.0 (X11; CrOS x86_64 12739.111.0) AppleWebKit/537.36 (KHTML, like Gecko) Chrome/80.0.3987.162 Safari/537.36";"-99";"0";"0";"-99";"0";"0";"0";"0";"0";"0";"0";"-99";"-99";"-66";"-66";"0";"-66";"6464885,6464886,6464888,6465730,6473402,6473403,6465857,6464883,6464882,6464880,6479077,6479078,6479079,6465888,6465924,6473522,6530938,6473523,6467242,6466848,6466848,6466848,6466848,6466848,6466848,6466848,6466848,6466848,6466848,6535930,6467023,6521623,6473507,6521677,6466281,6467078,6521689,6521690,6464875";"0";"0";"0";"-77";"-77";"e0b42dec657f9352785f4a96b9fd5488";"1";"0";"1590416944";"2020-05-25 14:29:04";"2020-05-25 14:44:31";"0000-00-00 00:00:00";"102";"89";"67";"20";"40";"52";"252";"267";"869";"783";"0";"0";"901";"46";"820";"301";"0";"809";"839";"911";"926";"0";"281";"801";"b1e63729c7ded4a9d2d9334c69753dac"
"128";"0";"0";"31";"6464875";"-77";"1661";"1";"2";"2";"1";"573363407d01ed00108f6a66";"9";"9";"7";"9";"9";"1";"2";"8";"-77";"2";"5";"8";"8";"1";"1";"60";"1";"FOREX Trader";"56";"1";"-99";"none";"7";"2";"none";"-66";"-66";"-66";"-66";"-66";"-66";"-66";"-66";"-66";"-66";"-77";"-77";"-77";"-77";"-77";"-77";"-77";"-77";"-77";"-77";"-77";"-77";"-77";"-77";"-77";"-77";"-77";"-77";"-77";"-77";"-77";"-77";"-77";"-77";"-77";"-77";"-77";"-77";"-77";"-77";"-77";"-77";"-77";"-77";"-77";"-77";"-77";"-77";"-77";"-77";"isolation";"lack of commitment ";"poor communication skills";"character conflict";"lack of confidence";"confidence in qualification";"confidence";"individual value to co.";"positive outlook";"admiration of skills";"4";"1";"2";"4";"2";"1";"1";"1";"1";"1";"4";"4";"5";"3";"3";"1";"1";"1";"1";"1";"3";"4";"5";"4";"4";"2";"1";"2";"3";"3";"5";"4";"5";"4";"4";"2";"1";"3";"3";"3";"Mozilla/5.0 (Windows NT 6.1; WOW64) AppleWebKit/537.36 (KHTML, like Gecko) Chrome/81.0.4044.138 Safari/537.36";"-99";"0";"0";"-99";"0";"0";"0";"0";"0";"0";"0";"-99";"-99";"-66";"-66";"0";"-66";"6464885,6464886,6464888,6465730,6473402,6473403,6465857,6464883,6464882,6464880,6479077,6479078,6479079,6465888,6465924,6473522,6467023,6529429,6467037,6470606,6467043,6467043,6467043,6467043,6467043,6467043,6467043,6467043,6467043,6467043,6521622,6521623,6473507,6521677,6466281,6467078,6521689,6521690,6464875";"0";"0";"0";"-77";"-77";"e6fedb9be8595391faf53b404e45e8c6";"1";"0";"1590416961";"2020-05-25 14:29:21";"2020-05-25 14:57:02";"0000-00-00 00:00:00";"169";"120";"73";"15";"32";"53";"428";"472";"1613";"0";"533";"1448";"1617";"48";"1518";"0";"1476";"1501";"1555";"1630";"1661";"488";"0";"0";"532ff120ad1afcbcc81a77e0b89455f4"
