"158";"0";"0";"31";"6464875";"-77";"1674";"2";"2";"2";"1";"5d1d49b9bfcb7c001acc9a34";"4";"5";"2";"3";"5";"1";"3";"7";"-77";"6";"4";"7";"6";"7";"7";"10";"1";"Laborer";"57";"1";"-99";"-99";"7";"2";"-99";"-66";"-66";"-66";"-66";"-66";"-66";"-66";"-66";"-66";"-66";"-77";"-77";"-77";"-77";"-77";"-77";"-77";"-77";"-77";"-77";"-77";"-77";"-77";"-77";"-77";"-77";"-77";"-77";"-77";"-77";"-77";"-77";"-77";"-77";"-77";"-77";"-77";"-77";"-77";"-77";"-77";"-77";"-77";"-77";"-77";"-77";"-77";"-77";"-77";"-77";"He didn't share equally in the ball toss game";"He wasn't given enough time";"The member comes across as arrogant";"The person from group green is full of himself";"He is selfish";"He was the best candidate for the job";"He looks good";"He performed well in his job";"The project was done for group green";"The partner is part of group blue";"4";"4";"1";"2";"2";"1";"1";"2";"2";"2";"2";"4";"2";"2";"4";"1";"1";"2";"1";"4";"4";"5";"3";"3";"3";"3";"2";"3";"3";"2";"4";"5";"3";"3";"4";"3";"2";"3";"2";"2";"Mozilla/5.0 (Windows NT 10.0; Win64; x64; rv:76.0) Gecko/20100101 Firefox/76.0";"-99";"0";"0";"-99";"0";"0";"0";"0";"0";"0";"0";"-99";"-99";"-66";"-66";"0";"-66";"6464885,6464886,6464888,6465730,6473402,6473403,6465857,6464883,6464882,6464880,6479077,6479079,6479080,6465888,6465924,6473522,6467023,6529429,6467037,6470606,6467043,6467043,6467043,6467043,6467043,6467043,6467043,6467043,6467043,6467043,6521622,6521623,6473507,6521677,6466281,6467078,6521689,6521690,6464875";"0";"1";"0";"-77";"-77";"ae0477b1a79b972505cb7d0a2330e73b";"1";"0";"1590417269";"2020-05-25 14:34:29";"2020-05-25 15:02:23";"0000-00-00 00:00:00";"176";"153";"96";"29";"51";"76";"433";"484";"1468";"0";"552";"1349";"1491";"66";"1413";"0";"1379";"1393";"1442";"1537";"1674";"494";"0";"0";"d2e2c97783051dcc12fffd5c5e7a74e6"
"159";"0";"0";"31";"6464875";"-77";"1759";"2";"2";"2";"1";"5e6fe3e20e34ca0aa955b116";"1";"1";"1";"1";"1";"1";"1";"7";"-77";"7";"3";"9";"7";"9";"9";"10";"2";"student";"19";"1";"-99";"-99";"7";"2";"-99";"-66";"-66";"-66";"-66";"-66";"-66";"-66";"-66";"-66";"-66";"-77";"-77";"-77";"-77";"-77";"-77";"-77";"-77";"-77";"-77";"-77";"-77";"-77";"-77";"-77";"-77";"-77";"-77";"-77";"-77";"-77";"-77";"-77";"-77";"-77";"-77";"-77";"-77";"-77";"-77";"-77";"-77";"-77";"-77";"-77";"-77";"-77";"-77";"-77";"-77";"The friend doesn't like hanging out with a bully anymore.";"They don't know how to work ethically and in a timely manner.";"They left me out of the game.";"I assume the other person saw who they really were and wanted no part of it.";"The member is a bad friend and person in general.";"They put away their bully mentality and went for what they wanted.";"The guy might be cute, but mean.";"He bullied his way to the top.";"It was good?";"They left me out of the game.";"1";"1";"1";"5";"1";"1";"1";"1";"1";"1";"4";"1";"2";"1";"1";"5";"5";"5";"5";"2";"4";"3";"3";"2";"2";"5";"5";"4";"1";"3";"4";"3";"3";"2";"2";"5";"4";"2";"1";"3";"Mozilla/5.0 (Windows NT 10.0; Win64; x64) AppleWebKit/537.36 (KHTML, like Gecko) Chrome/81.0.4044.138 Safari/537.36";"-99";"0";"0";"-99";"0";"0";"0";"0";"0";"0";"0";"-99";"-99";"-66";"-66";"0";"-66";"6464885,6464886,6464888,6465730,6473402,6473403,6465857,6464883,6464882,6464880,6479077,6479079,6479080,6465888,6465924,6473522,6467023,6529429,6467037,6470606,6467043,6467043,6467043,6467043,6467043,6467043,6467043,6467043,6467043,6467043,6521622,6521623,6473507,6521677,6466281,6467078,6521689,6521690,6521690,6464875";"0";"1";"0";"-77";"-77";"719896634e900c9fd950189651f99fc2";"1";"0";"1590417272";"2020-05-25 14:34:32";"2020-05-25 15:03:51";"0000-00-00 00:00:00";"125";"109";"80";"26";"43";"63";"233";"252";"1591";"0";"306";"1515";"1622";"55";"1552";"0";"1532";"1541";"1572";"1669";"1759";"266";"0";"0";"c429055228c9c1dbfaf81cceda0cea24"
"160";"0";"0";"22";"6466848";"-77";"854";"2";"1";"2";"1";"5ec3eeb6450ed70977058afd";"2";"4";"1";"1";"5";"1";"2";"8";"-77";"-77";"-77";"-77";"-77";"-77";"-77";"-66";"-77";"-66";"-66";"-77";"-66";"-66";"-77";"-77";"-66";"-66";"Due to the enjoyment of the game, they forget about the work they are expected to complete. ";"-66";"-66";"-66";"Whilst playing the game they notice the other members clothes and accessories. They desire to have these things, and the act of seeing them up close motivates them to get a higher paying job.";"The original cyber ball game. If members of group yellow did not meet up, then the other member would not have met a friend who complimented them on their appearance.";"-66";"The group member gets a break from work to play cyber ball. This acts as a mental refresher so when they returned to complete the project, they were more motivated than they were originally.";"The enjoyment that the group member experienced whilst playing cyber ball is reflected in their attitude. They are more likely to appear happy to their partner, and as a result the partner also feels happy. Due to the similarity in the emotional states of both people, they connect more and the parter shows more emotion to the group member.";"-77";"1";"-77";"-77";"-77";"4";"2";"-77";"4";"2";"-77";"3";"-77";"-77";"-77";"3";"2";"-77";"3";"2";"-77";"4";"-77";"-77";"-77";"4";"4";"-77";"3";"4";"-77";"5";"-77";"-77";"-77";"4";"5";"-77";"4";"4";"-66";"-66";"-66";"-66";"-66";"-66";"-66";"-66";"-66";"-66";"-77";"-77";"-77";"-77";"-77";"-77";"-77";"-77";"-77";"-77";"-77";"-77";"-77";"-77";"-77";"-77";"-77";"-77";"-77";"-77";"-77";"-77";"-77";"-77";"-77";"-77";"-77";"-77";"-77";"-77";"-77";"-77";"-77";"-77";"-77";"-77";"-77";"-77";"-77";"-77";"Mozilla/5.0 (Windows NT 10.0; Win64; x64) AppleWebKit/537.36 (KHTML, like Gecko) Chrome/81.0.4044.138 Safari/537.36";"-99";"0";"0";"-99";"0";"0";"0";"0";"0";"0";"0";"-99";"-99";"-66";"-66";"0";"-66";"6464885,6464886,6464888,6465730,6473402,6465730,6473402,6473403,6465857,6464883,6464882,6464880,6479077,6479079,6479080,6465888,6465924,6473522,6530938,6473523,6467242,6466848,6466848,6466848,6466848,6466848,6466848";"0";"0";"0";"-77";"-77";"5d772c0b5e1af751d3f37b847ae752fa";"1";"0";"1590417272";"2020-05-25 14:34:32";"2020-05-25 14:52:25";"0000-00-00 00:00:00";"156";"138";"92";"24";"45";"77";"259";"293";"0";"1073";"0";"0";"0";"62";"0";"329";"0";"0";"0";"0";"0";"0";"302";"0";"a5f8207e50961fa9cbb137a9a86ae311"
"161";"0";"0";"31";"6464875";"-77";"982";"2";"2";"2";"1";"5e93bc1f9eeb7a702cb64e10";"4";"4";"2";"3";"5";"3";"1";"5";"-77";"2";"6";"5";"4";"7";"7";"6";"1";"FastFood";"22";"1";"-99";"-99";"6";"2";"-99";"-66";"-66";"-66";"-66";"-66";"-66";"-66";"-66";"-66";"-66";"-77";"-77";"-77";"-77";"-77";"-77";"-77";"-77";"-77";"-77";"-77";"-77";"-77";"-77";"-77";"-77";"-77";"-77";"-77";"-77";"-77";"-77";"-77";"-77";"-77";"-77";"-77";"-77";"-77";"-77";"-77";"-77";"-77";"-77";"-77";"-77";"-77";"-77";"-77";"-77";"The friend is angry with them.";"The member is overwhelmed with the task at hand.";"The information stated may not have been popular with said audience. ";"Perhaps the Green group has a lot of unpopular opinions and are frowned upon.";"They have warned their friend before if they don't want to listen to their advice then stop asking for it.";"The said member proved that they were a great fit for the position.";"Typically friends compliment each other.";"Through hard work this member was recognized. ";"Through dedication and effort the hard work is shown.";"They are in a happy thriving relationship.";"3";"3";"3";"3";"3";"4";"3";"3";"1";"3";"1";"3";"5";"5";"2";"3";"3";"3";"2";"3";"3";"3";"3";"3";"3";"3";"3";"3";"3";"3";"5";"4";"4";"5";"3";"3";"3";"3";"4";"3";"Mozilla/5.0 (Windows NT 6.3; Win64; x64) AppleWebKit/537.36 (KHTML, like Gecko) Chrome/81.0.4044.138 Safari/537.36";"-99";"0";"0";"-99";"0";"0";"0";"0";"0";"0";"0";"-99";"-99";"-66";"-66";"0";"-66";"6464885,6464886,6464888,6465730,6473402,6473403,6465857,6464883,6464882,6464880,6479077,6479079,6479080,6465888,6465924,6473522,6467023,6529429,6467037,6470606,6467043,6467043,6467043,6467043,6467043,6467043,6467043,6467043,6467043,6467043,6521622,6521623,6473507,6521677,6466281,6467078,6521689,6521690,6464875";"0";"1";"0";"-77";"-77";"77a84fa0aedca66e8891f530b6823b24";"1";"0";"1590417273";"2020-05-25 14:34:33";"2020-05-25 14:50:55";"0000-00-00 00:00:00";"101";"88";"67";"36";"49";"62";"221";"242";"914";"0";"297";"832";"918";"56";"874";"0";"853";"865";"897";"924";"982";"252";"0";"0";"c0969b8172fecac6346dff56e3071260"
"162";"0";"0";"31";"6464875";"-77";"1201";"2";"1";"2";"1";"5d55ae4bd8706c001986f4b7";"1";"1";"3";"1";"1";"1";"2";"6";"3";"-77";"6";"6";"4";"9";"9";"10";"2";"Student";"21";"1";"-99";"-99";"6";"2";"-99";"A misunderstanding between Yellow and their friend";"Yellow does not have good time management skills to handle the tasks assigned to them ";"Ignorance regarding the topic of the talk and having an undeserved belief they're an expert ";"They play the game poorly";"Yellow's sense of morality does not allow them to assist a friend with a problem when they believe the outcome is one of cruelty to another ";"They are qualified for the position and would fit well within the role";"The member of group yellow put effort into making a noticeable change to their appearance for the occasion they meet their friend";"Devotion and hardwork ";"They put a lot of effort into a project which has a large pool of interest";"An incident occured that had their partner reevaluate the value that Yellow has in their life and decided to show their appreciation for Yellow's presence with increased displays of affection";"5";"1";"1";"1";"1";"1";"1";"1";"1";"4";"5";"1";"1";"1";"1";"1";"1";"1";"2";"5";"4";"2";"3";"5";"1";"1";"4";"1";"3";"4";"5";"2";"4";"4";"1";"1";"5";"1";"1";"3";"-66";"-66";"-66";"-66";"-66";"-66";"-66";"-66";"-66";"-66";"-77";"-77";"-77";"-77";"-77";"-77";"-77";"-77";"-77";"-77";"-77";"-77";"-77";"-77";"-77";"-77";"-77";"-77";"-77";"-77";"-77";"-77";"-77";"-77";"-77";"-77";"-77";"-77";"-77";"-77";"-77";"-77";"-77";"-77";"-77";"-77";"-77";"-77";"-77";"-77";"Mozilla/5.0 (Windows NT 10.0; Win64; x64) AppleWebKit/537.36 (KHTML, like Gecko) Chrome/81.0.4044.138 Safari/537.36";"-99";"0";"0";"-99";"0";"0";"0";"0";"0";"0";"0";"-99";"-99";"-66";"-66";"0";"-66";"6464885,6464886,6464888,6465730,6473402,6473403,6465857,6464883,6464882,6464880,6479077,6479079,6479080,6465888,6465924,6473522,6530938,6473523,6467242,6466848,6466848,6466848,6466848,6466848,6466848,6466848,6466848,6466848,6466848,6535930,6467023,6521623,6473507,6521677,6466281,6467078,6521689,6521690,6464875";"0";"1";"0";"-77";"-77";"6c84dc27bee6d1c44a64f01cb5b2e053";"1";"0";"1590417276";"2020-05-25 14:34:36";"2020-05-25 14:54:37";"0000-00-00 00:00:00";"125";"104";"68";"20";"34";"52";"221";"249";"1142";"1027";"0";"0";"1178";"43";"1095";"288";"0";"1080";"1125";"1182";"1201";"0";"260";"1059";"cf0993f4039e48b34a15626ff23a2264"
"163";"0";"0";"31";"6464875";"-77";"816";"2";"2";"2";"1";"5e8f622e9e934e23d3bb7741";"1";"1";"1";"1";"1";"1";"2";"4";"-77";"5";"2";"5";"6";"9";"9";"5";"1";"student ";"20";"1";"-99";"-99";"7";"2";"-99";"-66";"-66";"-66";"-66";"-66";"-66";"-66";"-66";"-66";"-66";"-77";"-77";"-77";"-77";"-77";"-77";"-77";"-77";"-77";"-77";"-77";"-77";"-77";"-77";"-77";"-77";"-77";"-77";"-77";"-77";"-77";"-77";"-77";"-77";"-77";"-77";"-77";"-77";"-77";"-77";"-77";"-77";"-77";"-77";"-77";"-77";"-77";"-77";"-77";"-77";"they did something to offend them ";"they got stopped due to cheating ";"probably acted as if they were better ";"they did something bad again ";"more concerned about themselves ";"did well in the interview and learnt specific answers ";"one of their good friends from a young age ";"been doing good work ";"put in work to do well";"new relationship so more exciting ";"3";"1";"4";"2";"3";"4";"2";"2";"2";"4";"2";"1";"2";"1";"2";"1";"3";"1";"2";"3";"5";"4";"3";"3";"1";"4";"2";"2";"3";"4";"4";"3";"4";"3";"1";"2";"2";"1";"3";"4";"Mozilla/5.0 (Macintosh; Intel Mac OS X 10_14_6) AppleWebKit/605.1.15 (KHTML, like Gecko) Version/13.1 Safari/605.1.15";"-99";"0";"0";"-99";"0";"0";"0";"0";"0";"0";"0";"-99";"-99";"-66";"-66";"0";"-66";"6464885,6464886,6464888,6465730,6473402,6473403,6465857,6464883,6464882,6464880,6479077,6479079,6479080,6465888,6465924,6473522,6467023,6529429,6467037,6470606,6467043,6467043,6467043,6467043,6467043,6467043,6467043,6467043,6467043,6467043,6521622,6521623,6473507,6521677,6466281,6467078,6521689,6521690,6464875";"1";"1";"0";"-77";"-77";"51f6a3a8fc1ea8df09d326c0c7d915b8";"1";"0";"1590417279";"2020-05-25 14:34:39";"2020-05-25 14:48:15";"0000-00-00 00:00:00";"129";"108";"56";"15";"26";"44";"241";"264";"789";"0";"325";"722";"796";"35";"756";"0";"734";"744";"778";"798";"816";"269";"0";"0";"13ce12f17a5fd7dcf70f127f7185db39"
"164";"0";"0";"31";"6464875";"-77";"1481";"2";"1";"2";"1";"5d70dd0b28805f001aaf9a94";"5";"5";"5";"5";"7";"1";"2";"5";"4";"-77";"3";"7";"7";"7";"7";"10";"2";"Home maker";"60";"1";"-99";"no";"7";"2";"no";"A friend that has total respect .";"There could be to much work for them to do or there could be complications within the job";"That nobody is paying attention to the speaker";"Not friends just enemies";"Because the friend is new and nobody knows them well enough to help .";"They have the right skills needed for the job";"The friend is kind and caring";"Works well at the job he does";"Is very skilful at his work";"Because they respect and love each other ";"1";"3";"4";"5";"4";"1";"1";"1";"1";"1";"1";"3";"4";"5";"4";"1";"1";"1";"1";"1";"1";"3";"3";"3";"3";"1";"1";"1";"1";"1";"1";"3";"3";"1";"3";"1";"1";"1";"1";"1";"-66";"-66";"-66";"-66";"-66";"-66";"-66";"-66";"-66";"-66";"-77";"-77";"-77";"-77";"-77";"-77";"-77";"-77";"-77";"-77";"-77";"-77";"-77";"-77";"-77";"-77";"-77";"-77";"-77";"-77";"-77";"-77";"-77";"-77";"-77";"-77";"-77";"-77";"-77";"-77";"-77";"-77";"-77";"-77";"-77";"-77";"-77";"-77";"-77";"-77";"Mozilla/5.0 (Windows NT 10.0; Win64; x64) AppleWebKit/537.36 (KHTML, like Gecko) Chrome/81.0.4044.138 Safari/537.36";"-99";"0";"0";"-99";"0";"0";"0";"0";"0";"0";"0";"-99";"-99";"-66";"-66";"0";"-66";"6464885,6464886,6464888,6465730,6473402,6473403,6465857,6464883,6464882,6464880,6479077,6479079,6479080,6465888,6465924,6473522,6530938,6473523,6467242,6466848,6466848,6466848,6466848,6466848,6466848,6466848,6466848,6466848,6466848,6535930,6467023,6521623,6473507,6521677,6466281,6466281,6466281,6467078,6521689,6521690,6464875";"0";"1";"0";"-77";"-77";"33e05a30cb9e864f79ffd3a020c6c83c";"1";"0";"1590417281";"2020-05-25 14:34:41";"2020-05-25 14:59:22";"0000-00-00 00:00:00";"272";"251";"140";"28";"58";"108";"512";"555";"1395";"1196";"0";"0";"1405";"92";"1307";"621";"0";"1298";"1355";"1427";"1481";"0";"573";"1283";"e621b294f40e8dcefd92f9e4bd81218f"
"165";"0";"0";"22";"6479078";"-77";"318";"1";"2";"2";"1";"5d1fcae3d7833d000102e92b";"-77";"-77";"-77";"-77";"-77";"-77";"-77";"-77";"-77";"-77";"-77";"-77";"-77";"-77";"-77";"-66";"-77";"-66";"-66";"-77";"-66";"-66";"-77";"-77";"-66";"-66";"-66";"-66";"-66";"-66";"-66";"-66";"-66";"-66";"-66";"-77";"-77";"-77";"-77";"-77";"-77";"-77";"-77";"-77";"-77";"-77";"-77";"-77";"-77";"-77";"-77";"-77";"-77";"-77";"-77";"-77";"-77";"-77";"-77";"-77";"-77";"-77";"-77";"-77";"-77";"-77";"-77";"-77";"-77";"-77";"-77";"-77";"-77";"-77";"-77";"-66";"-66";"-66";"-66";"-66";"-66";"-66";"-66";"-66";"-66";"-77";"-77";"-77";"-77";"-77";"-77";"-77";"-77";"-77";"-77";"-77";"-77";"-77";"-77";"-77";"-77";"-77";"-77";"-77";"-77";"-77";"-77";"-77";"-77";"-77";"-77";"-77";"-77";"-77";"-77";"-77";"-77";"-77";"-77";"-77";"-77";"-77";"-77";"-77";"-77";"Mozilla/5.0 (Windows NT 10.0; Win64; x64) AppleWebKit/537.36 (KHTML, like Gecko) Chrome/81.0.4044.138 Safari/537.36";"-99";"0";"0";"-99";"0";"0";"0";"0";"0";"0";"0";"-99";"-99";"-66";"-66";"0";"-66";"6464885,6464886,6464888,6465730,6473402,6473403,6465857,6464883,6464882,6464880,6479077,6479078";"0";"1";"0";"-77";"-77";"d8dbedba649018138627603143bc4dc8";"1";"0";"1590417284";"2020-05-25 14:34:44";"2020-05-25 14:40:33";"0000-00-00 00:00:00";"349";"318";"270";"179";"199";"233";"0";"0";"0";"0";"0";"0";"0";"223";"0";"0";"0";"0";"0";"0";"0";"0";"0";"0";"852a09a4fbda0ca99d1917160793ec86"
"166";"0";"0";"22";"6479080";"-77";"1242";"2";"1";"2";"1";"5e9e1d11ac750d1e12b11187";"-77";"-77";"-77";"-77";"-77";"-77";"-77";"-77";"-77";"-77";"-77";"-77";"-77";"-77";"-77";"-66";"-77";"-66";"-66";"-77";"-66";"-66";"-77";"-77";"-66";"-66";"-66";"-66";"-66";"-66";"-66";"-66";"-66";"-66";"-66";"-77";"-77";"-77";"-77";"-77";"-77";"-77";"-77";"-77";"-77";"-77";"-77";"-77";"-77";"-77";"-77";"-77";"-77";"-77";"-77";"-77";"-77";"-77";"-77";"-77";"-77";"-77";"-77";"-77";"-77";"-77";"-77";"-77";"-77";"-77";"-77";"-77";"-77";"-77";"-77";"-66";"-66";"-66";"-66";"-66";"-66";"-66";"-66";"-66";"-66";"-77";"-77";"-77";"-77";"-77";"-77";"-77";"-77";"-77";"-77";"-77";"-77";"-77";"-77";"-77";"-77";"-77";"-77";"-77";"-77";"-77";"-77";"-77";"-77";"-77";"-77";"-77";"-77";"-77";"-77";"-77";"-77";"-77";"-77";"-77";"-77";"-77";"-77";"-77";"-77";"Mozilla/5.0 (Windows NT 10.0; Win64; x64) AppleWebKit/537.36 (KHTML, like Gecko) Chrome/70.0.3538.102 Safari/537.36 Edge/18.18362";"-99";"0";"0";"-99";"0";"0";"0";"0";"0";"0";"0";"-99";"-99";"-66";"-66";"0";"-66";"6464885,6464886,6464888,6465730,6473402,6473403,6465857,6464883,6464882,6464880,6479077,6479079,6464880,6464880,6479077,6479079,6479080";"0";"0";"0";"-77";"-77";"afdcb7615465b5461d9cb39477c55abe";"1";"0";"1590417285";"2020-05-25 14:34:45";"2020-05-25 14:55:30";"0000-00-00 00:00:00";"1245";"80";"53";"13";"29";"42";"0";"0";"0";"0";"0";"0";"0";"37";"0";"0";"0";"0";"0";"0";"0";"0";"0";"0";"6e2886884d9959f7c6294cd2b817a7bc"
"167";"0";"0";"31";"6464875";"-77";"1086";"2";"1";"2";"1";"5bc2b8b7a1241c0001d5d471";"1";"1";"1";"1";"1";"1";"2";"5";"6";"-77";"5";"9";"9";"9";"9";"2";"1";"Lawyer";"28";"1";"-99";"No";"7";"2";"-99";"The friend has some baggage that we don't know about";"Yellow's group member did not have good time management.";"The mindset of the audience was contrary to what Yellow wanted it to be.";"Something wrong was said or done";"The friend's problem is of no concern to group yellow.";"Yellow member's determination was instrumental.";"Yellow member looks good due to genetics and good grooming habits";"Yellow's performance warranted a raise.";"Hard work by group yellow's member.";"Yellow member's partner has increased feelings of affection.";"5";"1";"5";"3";"1";"1";"1";"1";"5";"5";"5";"5";"5";"3";"1";"1";"1";"1";"1";"5";"5";"5";"5";"5";"5";"5";"5";"5";"5";"5";"5";"5";"5";"5";"5";"5";"5";"5";"5";"5";"-66";"-66";"-66";"-66";"-66";"-66";"-66";"-66";"-66";"-66";"-77";"-77";"-77";"-77";"-77";"-77";"-77";"-77";"-77";"-77";"-77";"-77";"-77";"-77";"-77";"-77";"-77";"-77";"-77";"-77";"-77";"-77";"-77";"-77";"-77";"-77";"-77";"-77";"-77";"-77";"-77";"-77";"-77";"-77";"-77";"-77";"-77";"-77";"-77";"-77";"Mozilla/5.0 (Windows NT 10.0; Win64; x64) AppleWebKit/537.36 (KHTML, like Gecko) Chrome/81.0.4044.138 Safari/537.36";"-99";"0";"0";"-99";"0";"0";"0";"0";"0";"0";"0";"-99";"-99";"-66";"-66";"0";"-66";"6464885,6464886,6464888,6465730,6473402,6473403,6465857,6464883,6464882,6464880,6479077,6479079,6479080,6465888,6465924,6473522,6530938,6473523,6467242,6466848,6466848,6466848,6466848,6466848,6466848,6466848,6466848,6466848,6466848,6535930,6467023,6521623,6473507,6521677,6466281,6467078,6521689,6521690,6464875";"0";"1";"0";"-77";"-77";"bc93129f983bb9fd34e0a8a5042f50dc";"1";"0";"1590417302";"2020-05-25 14:35:02";"2020-05-25 14:53:08";"0000-00-00 00:00:00";"58";"51";"34";"13";"17";"27";"174";"186";"889";"821";"0";"0";"893";"20";"861";"196";"0";"852";"874";"1079";"1086";"0";"190";"836";"93d782fcd2fde1a6ca2af86f2f395e69"
"168";"0";"0";"31";"6464875";"-77";"638";"1";"1";"2";"1";"5e8db84a4f4f7003d0e6afa7";"7";"6";"6";"6";"6";"1";"2";"6";"4";"-77";"6";"6";"5";"2";"2";"30";"2";"phd student";"41";"1";"-99";"-99";"6";"2";"-99";"someones behaviour";"hard work";"poor performance";"a disagreement";"the member of group yellow";"a good application";"they look nice";"doing their job well";"good work";"their partner loves them";"3";"2";"2";"3";"2";"2";"4";"2";"2";"2";"3";"2";"2";"3";"2";"2";"3";"2";"2";"3";"4";"4";"4";"4";"4";"4";"3";"4";"4";"4";"4";"4";"4";"4";"4";"4";"4";"4";"4";"4";"-66";"-66";"-66";"-66";"-66";"-66";"-66";"-66";"-66";"-66";"-77";"-77";"-77";"-77";"-77";"-77";"-77";"-77";"-77";"-77";"-77";"-77";"-77";"-77";"-77";"-77";"-77";"-77";"-77";"-77";"-77";"-77";"-77";"-77";"-77";"-77";"-77";"-77";"-77";"-77";"-77";"-77";"-77";"-77";"-77";"-77";"-77";"-77";"-77";"-77";"Mozilla/5.0 (Macintosh; Intel Mac OS X 10_14_4) AppleWebKit/605.1.15 (KHTML, like Gecko) Version/12.1 Safari/605.1.15";"-99";"0";"0";"-99";"0";"0";"0";"0";"0";"0";"0";"-99";"-99";"-66";"-66";"0";"-66";"6464885,6464886,6464888,6465730,6473402,6473403,6465857,6464883,6464882,6464880,6479077,6479078,6479079,6465888,6465924,6473522,6530938,6473523,6467242,6466848,6466848,6466848,6466848,6466848,6466848,6466848,6466848,6466848,6466848,6535930,6467023,6521623,6473507,6521677,6466281,6467078,6521689,6521690,6464875";"1";"1";"0";"-77";"-77";"e0280b6636fbd4299b8c3cf2a4f09bc2";"1";"0";"1590417308";"2020-05-25 14:35:08";"2020-05-25 14:45:46";"0000-00-00 00:00:00";"88";"73";"51";"17";"24";"40";"199";"215";"598";"517";"0";"0";"619";"30";"558";"231";"0";"541";"580";"625";"638";"0";"220";"534";"c8db34f8b5f95ea624715c7968b1dd8c"
"169";"0";"0";"20";"0";"-77";"0";"-66";"-66";"-77";"-77";"-66";"-77";"-77";"-77";"-77";"-77";"-77";"-77";"-77";"-77";"-77";"-77";"-77";"-77";"-77";"-77";"-66";"-77";"-66";"-66";"-77";"-66";"-66";"-77";"-77";"-66";"-66";"-66";"-66";"-66";"-66";"-66";"-66";"-66";"-66";"-66";"-77";"-77";"-77";"-77";"-77";"-77";"-77";"-77";"-77";"-77";"-77";"-77";"-77";"-77";"-77";"-77";"-77";"-77";"-77";"-77";"-77";"-77";"-77";"-77";"-77";"-77";"-77";"-77";"-77";"-77";"-77";"-77";"-77";"-77";"-77";"-77";"-77";"-77";"-77";"-77";"-66";"-66";"-66";"-66";"-66";"-66";"-66";"-66";"-66";"-66";"-77";"-77";"-77";"-77";"-77";"-77";"-77";"-77";"-77";"-77";"-77";"-77";"-77";"-77";"-77";"-77";"-77";"-77";"-77";"-77";"-77";"-77";"-77";"-77";"-77";"-77";"-77";"-77";"-77";"-77";"-77";"-77";"-77";"-77";"-77";"-77";"-77";"-77";"-77";"-77";"Mozilla/5.0 (Linux; Android 8.1.0; LG-M200) AppleWebKit/537.36 (KHTML, like Gecko) Chrome/74.0.3729.157 Mobile Safari/537.36";"-99";"0";"0";"-99";"0";"0";"0";"0";"0";"0";"0";"-99";"-99";"-66";"-66";"0";"-66";"0";"1";"0";"0";"-77";"-77";"02ab582d082473d57a09b6f25bd86948";"1";"0";"1590417310";"2020-05-25 14:35:10";"2020-05-25 14:35:10";"0000-00-00 00:00:00";"0";"0";"0";"0";"0";"0";"0";"0";"0";"0";"0";"0";"0";"0";"0";"0";"0";"0";"0";"0";"0";"0";"0";"0";"-66"
"170";"0";"0";"31";"6464875";"-77";"822";"1";"2";"2";"1";"5e7497a788c1c140104c87ab";"7";"8";"6";"7";"8";"1";"2";"4";"-77";"5";"3";"7";"6";"4";"4";"25";"1";"Student/ volunteer";"34";"1";"-99";"-99";"6";"2";"-99";"-66";"-66";"-66";"-66";"-66";"-66";"-66";"-66";"-66";"-66";"-77";"-77";"-77";"-77";"-77";"-77";"-77";"-77";"-77";"-77";"-77";"-77";"-77";"-77";"-77";"-77";"-77";"-77";"-77";"-77";"-77";"-77";"-77";"-77";"-77";"-77";"-77";"-77";"-77";"-77";"-77";"-77";"-77";"-77";"-77";"-77";"-77";"-77";"-77";"-77";"Unresolved conflict.";"More concerned with self over the tasks.";"Content was incorrect for the audience ";"Lack of reciprocity ";"More self centered in nature";"The job they apply for is a good fit for them";"Because they look after themself";"Being inclusive of all members";"They worked hard";"They evolve into a better person";"4";"2";"2";"2";"2";"1";"2";"2";"2";"1";"4";"2";"2";"2";"2";"1";"4";"2";"2";"1";"4";"4";"2";"4";"4";"2";"2";"2";"4";"2";"3";"4";"2";"3";"3";"2";"3";"2";"3";"2";"Mozilla/5.0 (Windows NT 10.0; Win64; x64) AppleWebKit/537.36 (KHTML, like Gecko) Chrome/81.0.4044.138 Safari/537.36";"-99";"0";"0";"-99";"0";"0";"0";"0";"0";"0";"0";"-99";"-99";"-66";"-66";"0";"-66";"6464885,6464886,6464888,6465730,6473402,6473403,6465857,6464883,6464882,6464880,6479077,6479078,6479079,6465888,6465924,6473522,6467023,6529429,6467037,6470606,6467043,6467043,6467043,6467043,6467043,6467043,6467043,6467043,6467043,6467043,6521622,6521623,6473507,6521677,6466281,6467078,6521689,6521690,6464875";"1";"0";"0";"-77";"-77";"03ddcb71dcfa28921c1532a1c293f7cd";"1";"0";"1590417311";"2020-05-25 14:35:11";"2020-05-25 14:48:53";"0000-00-00 00:00:00";"116";"108";"69";"16";"46";"67";"222";"246";"802";"0";"280";"708";"803";"59";"757";"0";"729";"749";"785";"805";"822";"257";"0";"0";"74581c1271bc248af5e631a1273030e8"
"171";"0";"0";"31";"6465732";"-77";"26";"-66";"-66";"1";"-77";"-66";"-77";"-77";"-77";"-77";"-77";"-77";"-77";"-77";"-77";"-77";"-77";"-77";"-77";"-77";"-77";"-66";"-77";"-66";"-66";"-77";"-66";"-66";"-77";"-77";"-66";"-66";"-66";"-66";"-66";"-66";"-66";"-66";"-66";"-66";"-66";"-77";"-77";"-77";"-77";"-77";"-77";"-77";"-77";"-77";"-77";"-77";"-77";"-77";"-77";"-77";"-77";"-77";"-77";"-77";"-77";"-77";"-77";"-77";"-77";"-77";"-77";"-77";"-77";"-77";"-77";"-77";"-77";"-77";"-77";"-77";"-77";"-77";"-77";"-77";"-77";"-66";"-66";"-66";"-66";"-66";"-66";"-66";"-66";"-66";"-66";"-77";"-77";"-77";"-77";"-77";"-77";"-77";"-77";"-77";"-77";"-77";"-77";"-77";"-77";"-77";"-77";"-77";"-77";"-77";"-77";"-77";"-77";"-77";"-77";"-77";"-77";"-77";"-77";"-77";"-77";"-77";"-77";"-77";"-77";"-77";"-77";"-77";"-77";"-77";"-77";"Mozilla/5.0 (Macintosh; Intel Mac OS X 10_10_5) AppleWebKit/537.36 (KHTML, like Gecko) Chrome/81.0.4044.138 Safari/537.36";"-99";"0";"0";"-99";"0";"0";"0";"0";"0";"0";"0";"-99";"-99";"-66";"-66";"0";"-66";"6464885,6464886,6464888,6465730,6465732";"0";"1";"0";"-77";"-77";"1ff5b866404de06787aa3fd21c7a0466";"1";"0";"1590417325";"2020-05-25 14:35:25";"2020-05-25 14:35:51";"0000-00-00 00:00:00";"0";"0";"0";"7";"26";"0";"0";"0";"0";"0";"0";"0";"0";"0";"0";"0";"0";"0";"0";"0";"0";"0";"0";"0";"-66"
